{
  "acquisition_id": "ACQ-55FB92E0AA0024F51429",
  "version": "1.0.0",
  "subject": "Physics",
  "bucket_id": "BUCKET-RELATIVE-MOTION",
  "resource_ref": "SRC-TEST-FIXTURE-REL",
  "source_kind": "FILE",
  "requested_locator": "fixture://relative-motion-source",
  "resolved_locator": "tests/fixtures/source_ingest/relative-motion-source.txt",
  "acquired_at": "2026-09-18",
  "media_type": "text/plain",
  "byte_length": 226,
  "sha256": "55fb92e0aa0024f514296e4d77bad50e485c0cacf661cc3f720411e211a98e17",
  "snapshot_ref": "tests/fixtures/source_ingest/relative-motion-source.txt"
}
